ID,Text,Comment
Cordial.DeleteThatThing.DisplayName,Lösche dieses Ding.,-
Cordial.DeleteThatThing.Description,Dieses Werkzeug löscht alle ausgewählten Objekte desselben Typs.,-
Cordial.DeleteThatThing.Prompt.Abort,Nicht alle ausgewählten Objekte konnten gelöscht werden. Wahrscheinlich befindet sich etwas über einem Objekt.,-
Cordial.DeleteThatThing.Prompt.Stump,Ein Baumstumpf wurde ausgewählt. Dies wird nur Baumstümpfe für den Abriss kennzeichnen. Möchten Sie fortfahren?,-
Cordial.DeleteThatThing.Prompt.DeadTree,Ein toter Baum wurde ausgewählt. Dies wird nur tote Bäume für den Abriss markieren. Möchten Sie fortfahren?,-
