ID,Text,Comment
Cordial.DeleteThatThing.DisplayName,Удалите эту вещь.,-
Cordial.DeleteThatThing.Description,Этот инструмент удаляет все выбранные объекты одного типа.,-
Cordial.DeleteThatThing.Prompt.Abort,"Не все выбранные объекты могут быть удалены. Вероятно, что-то расположено поверх объекта.",-
Cordial.DeleteThatThing.Prompt.Stump,Выбрано пни. Это будет касаться только пней для сноса. Вы хотите продолжить?,-
Cordial.DeleteThatThing.Prompt.DeadTree,Выбрано мёртвое дерево. Это будет означать только мёртвые деревья для сноса. Желаете продолжить?,-
