ID,Text,Comment
Building.PhoenixPod.Description,"Вдохновленные Железными Зубами, огненные шкуры используют эти капсулы для увеличения численности населения.",-
Building.PhoenixPod.DisplayName,Феникс Под,-
Building.AdvancedPhoenixPod.Description,"Использует продвинутый процесс разведения для производства взрослых бобров, готовых приступить к работе.",-
Building.AdvancedPhoenixPod.DisplayName,Расширенный Phoenix Pod,-
Building.AdvancedPhoenixPod.FlavorDescription,"Как феникс, пусть они возродятся из огня и пепла.",-
