ID,Text,Comment
evaporation.settings.enablemod,Activer le mod,-
evaporation.settings.enablemod.desc,Bascule l'ensemble du mod activé ou désactivé.,-
evaporation.settings.coveredevaporationrate,Taux d'évaporation couvert,-
evaporation.settings.coveredevaporationrate.desc,"À quelle vitesse ou lenteur l'eau couverte s'évapore par rapport à la vanille. 100 % = vanille, 1 % est 100 fois plus lent.",-
evaporation.settings.maxsearchheight,Hauteur de recherche de couverture,-
evaporation.settings.maxsearchheight.desc,"À quelle hauteur au-dessus de l'eau rechercher un abri. Des valeurs plus élevées détectent des structures plus hautes, mais peuvent affecter les performances sur de grandes cartes.",-
evaporation.settings.updateinterval,Vérifier la fréquence,-
evaporation.settings.updateinterval.desc,"À quelle fréquence mettre à jour la détection de couverture (1=plus rapide, 10=plus lent). Approximativement : 1≈demi-journée, 5≈2 jours, 10≈semaine.",-
