ID,Text,Comment
Knatte.DE_A_RMInvSlopeW.Description,"Quadrado de Metal Estriado que pode se destacar. 
Bloco hexagonal de colocação, toda a água, outros blocos apenas de cima/embaixo como um piso impermeável embutido. 
No estilo aqueduto.",-
Knatte.DE_A_RMInvSlopeW.FlavorDescription,Vamos lá,-
Knatte.DE_A_RMInvTrapeziumW1x1.DisplayName,Levee Metálico Invertido Trapézio 1x1,-
Knatte.DE_A_RMDoubleInvSlopeW.Description,"Quadrado de Metal Ranhurado que se destaca em ambos os lados. Bloco hexagonal de colocação, toda a água e outros blocos apenas de cima/baixo, como um piso impermeável embutido. Estilo Aqueduto.",-
Knatte.DE_A_RMDoubleInvSlopeW.FlavorDescription,Vamos construir uma ponte.,-
