ID,Text,Comment
LV.SE.Enabled,Ativado,-
LV.SE.EnabledDesc,Se este mod está habilitado.,-
LV.SE.SaveFrequency,Frequência de salvamento automático (dias),-
LV.SE.SaveFrequencyDesc,Com que frequência esse mod deve salvar automaticamente.,-
LV.SE.SaveCount,Contagem de salvamento automático,-
LV.SE.SaveCountDesc,Quantas auto-salvamentos devem ser mantidos.,-
LV.SE.SaveWeatherWarning,Economia extra em aviso meteorológico,-
LV.SE.SaveWeatherWarningDesc,"Quando um aviso de clima é emitido, faça uma cópia extra chamada 'weatherwarning.save' que só será sobrescrita pelo aviso do próximo ciclo. Esta cópia não conta para o total de cópias.",-
