ID,Text,Comment
Cordial.DeleteThatThing.DisplayName,Delete essa coisa.,-
Cordial.DeleteThatThing.Description,Esta ferramenta exclui todos os objetos selecionados do mesmo tipo.,-
Cordial.DeleteThatThing.Prompt.Abort,Nem todos os objetos selecionados puderam ser deletados. Algo provavelmente está colocado em cima de um objeto.,-
Cordial.DeleteThatThing.Prompt.Stump,Um toco de árvore foi selecionado. Isso marcará apenas tocos para demolição. Você deseja continuar?,-
Cordial.DeleteThatThing.Prompt.DeadTree,Uma árvore morta foi selecionada. Isso irá apenas marcar árvores mortas para demolição. Você deseja continuar?,-
