ID,Text,Comment
LV.CAS.Enabled,Включено,-
LV.CAS.EnabledDesc,Включен ли этот мод.,-
LV.CAS.SaveFrequency,Частота автосохранения (в реальных минутах),-
LV.CAS.SaveFrequencyDesc,Как часто должно выполняться авто-сохранение. Значение по умолчанию для игры: 10.,-
LV.CAS.SaveCount,Количество автосохранений,-
LV.CAS.SaveCountDesc,Сколько авто-сохранений следует хранить. Настройки по умолчанию игры: 3,-
LV.CAS.SaveWeatherWarning,Дополнительная экономия при предупреждении о погоде,-
LV.CAS.SaveWeatherWarningDesc,"Когда выдается предупреждение о погоде, создайте дополнительное сохранение с названием 'weatherwarning.save', которое будет перезаписываться только при следующем предупреждении цикла. Это сохранение не учитывается в общем счете сохранений.",-
LV.CAS.KeyBindingTriggerAutosave,Запустить авто-сохранение,-
