ID,Text,Comment
LV.CAS.Enabled,Включено,-
LV.CAS.EnabledDesc,Включен ли этот мод.,-
LV.CAS.SaveFrequency,Частота автоматического сохранения (реальная минута),-
LV.CAS.SaveFrequencyDesc,Как часто должен срабатывать автосохранение. Значение по умолчанию: 10,-
LV.CAS.SaveCount,Количество авто-сохранений,-
LV.CAS.SaveCountDesc,Сколько автосохранений должно быть сохранено. Значение по умолчанию в игре: 3,-
LV.CAS.SaveWeatherWarning,Дополнительная экономия на предупреждении о погоде,-
LV.CAS.SaveWeatherWarningDesc,"Когда выдается предупреждение о погоде, создайте дополнительное сохранение с именем 'weatherwarning.save', которое будет перезаписано только следующим предупреждением цикла. Это сохранение не учитывается в общем количестве сохранений.",-
LV.CAS.KeyBindingTriggerAutosave,Включить автоматическое сохранение,-
