ID,Text,Comment
LV.SE.Enabled,Включено,-
LV.SE.EnabledDesc,Включен ли этот мод.,-
LV.SE.SaveFrequency,Частота автосохранения (дни),-
LV.SE.SaveFrequencyDesc,Как часто этот мод должен автоматически сохранять.,-
LV.SE.SaveCount,Количество автосохранений,-
LV.SE.SaveCountDesc,Сколько авто-сохранений следует хранить?,-
LV.SE.SaveWeatherWarning,Дополнительная экономия при предупреждении о погоде,-
LV.SE.SaveWeatherWarningDesc,"Когда выдаётся предупреждение о погоде, создайте дополнительное сохранение с именем 'weatherwarning.save', которое будет перезаписываться только следующим предупреждением цикла. Это сохранение не учитывается в общем числе сохранений.",-
