ID,Text,Comment
LV.TAT.UnlimitedMapSize,Unbegrenzte Karten Größe,-
LV.TAT.UnlimitedMapSizeDesc,Entfernen Sie die Standardkartenbegrenzung von 256x256.,-
LV.TAT.GameToMap,Spiel speichern als Karte,-
LV.TAT.GameToMapDesc,"Erlaube es, dein normales Spiel in Karten zu speichern. Die Tasten erscheinen oben links, während du das Spiel spielst. Du kannst diese Karte auch im Steam Workshop hochladen. NICHT im Karten-Editor.",-
LV.TAT.LockOnSaveMap,Gebäudeentsperrung rückgängig machen,-
LV.TAT.LockOnSaveMapDesc,"Beim Speichern einer Karte, setzen Sie die Gebäude in ihren ursprünglichen gesperrten Zustand zurück. Sie haben sie möglicherweise während der Erstellung der Karte entsperrt. Wenn Sie dies nicht überprüfen, bleiben die Gebäude für Spieler, die ein neues Spiel beginnen, entsperrt.",-
LV.TAT.DefaultWaterSourceStrength,Standardstärke der Wasserquelle,-
LV.TAT.DefaultWaterSourceStrengthDesc,Die Standardstärke der Wasserquelle beim Platzieren von Wasserquellen im Karteneditor. Dies gilt sowohl für frische als auch für schlechte Wasserquellen.,-
