ID,Text,Comment
LV.CFac.RemoveDup,"Versuchen Sie, Duplikate zu entfernen (Neustart erforderlich).",-
LV.CFac.RemoveDupDesc,"Versuche, Gebäude mit ähnlichen Namen zu entfernen, wenn alle Fraktionen sie haben (wie Pfad oder Plattformen).",-
LV.CFac.AddPlants,Füge Pflanzen hinzu (Gewächse und Bäume),-
LV.CFac.AddPlantsDesc,"Sie können Pflanzen und Bäume anderer Fraktionen anbauen. Sie müssen das Aquatische Bauernhaus der Folktails zu allen anderen Fraktionen hinzufügen, um Abstürze zu vermeiden.",-
LV.CFac.AddPlantsNotif,"Sie müssen Aquatic Farmhouse zu Iron Teeth hinzufügen, da es sonst beim Laden für Iron Teeth abstürzt.",-
