ID,Text,Comment
HB.BrokenTeeth,Désactiver les dents cassées,-
HB.BrokenTeethDesc,Désactiver les dents cassées,-
HB.BeeSting,Désactiver la piqûre d'abeille,-
HB.BeeStingDesc,Désactiver la piqûre d'abeille,-
HB.BadwaterContamination,Désactiver la contamination de Badwater,-
HB.BadwaterContaminationDesc,"Désactiver la contamination de Badwater, les castors tombent toujours malades lorsqu'ils sont en contact avec Badwater, mais cela ne sera pas contaminé.",-
HB.Injury,Désactiver la blessure,-
HB.InjuryDesc,Désactiver les blessures,-
