ID,Text,Comment
LV.TAT.UnlimitedMapSize,無制限の地図サイズ,-
LV.TAT.UnlimitedMapSizeDesc,デフォルトのマップサイズ制限256x256を解除する,-
LV.TAT.GameToMap,ゲームを地図として保存,-
LV.TAT.GameToMapDesc,通常のゲームをマップに保存することを許可します。ゲームをプレイしているときに、ボタンが左上隅に表示されます。また、そのマップをSteamワークショップにアップロードすることもできます。マップエディターではありません。,-
LV.TAT.LockOnSaveMap,建物のロック解除を元に戻す,-
LV.TAT.LockOnSaveMapDesc,地図を保存する際には、建物を元のロックされた状態に戻してください。地図を作成している間に建物を解除した可能性があります。このチェックを行わないと、新たにゲームを始めるプレイヤーにとって建物は解除されたままになります。,-
LV.TAT.DefaultWaterSourceStrength,デフォルトの水源の強度,-
LV.TAT.DefaultWaterSourceStrengthDesc,マップエディターで水源を配置する際のデフォルトの水源の強さです。これは、淡水および汚水の両方の水源に適用されます。,-
