ID,Text,Comment
minorunara.ToriiGates.PrimitiveToriiGate.DisplayName,Pierwotna brama Torii,-
minorunara.ToriiGates.PrimitiveToriiGate.Description,Praprzybyte brama torii złożona z połączonych bali.,-
minorunara.ToriiGates.PrimitiveToriiGate.Flavor,"Nie jest dobrze znane, dlaczego zbudowano bramę torii, ale powszechnie panująca teoria głosi, że miała na celu ofiarowanie smacznych kłód królowi bobrów.",-
minorunara.ToriiGates.SimpleToriiGate.DisplayName,Prosty brama Torii,-
minorunara.ToriiGates.SimpleToriiGate.Description,Prosty gate torii wykonany z desek.,-
minorunara.ToriiGates.SimpleToriiGate.Flavor,"„Hej, to wygląda na naprawdę smaczną bramę torii!” —Pina",-
minorunara.ToriiGates.DemoToriiGate.DisplayName,Demo wersja. Brama Torii,-
minorunara.ToriiGates.DemoToriiGate.Description,"To jest reprodukcja bramy torii, która istniała, gdy Timberborn był jeszcze w wersji demonstracyjnej.",-
minorunara.ToriiGates.DemoToriiGate.Flavor,"""To smak historii."" —Pina",-
minorunara.ToriiGates.IronToriiGate.DisplayName,Żelazna brama Torii,-
minorunara.ToriiGates.IronToriiGate.Description,Bramka torii Shinmei zrobiona z żelaza.,-
minorunara.ToriiGates.IronToriiGate.Flavor,"Wiele bobrów gryzie prostą bramę torii, więc przeciwdziałaliśmy temu, tworząc je z żelaza.",-
minorunara.ToriiGates.TreatedToriiGate.DisplayName,Leczony Brama Torii,-
minorunara.ToriiGates.TreatedToriiGate.Description,Bramka torii Myojin.,-
minorunara.ToriiGates.TreatedToriiGate.Flavor,"Luksusowe torii wykonane z najlepszego drewna pokrytego żywicą sosnową. Duża liczba bobrów pilnuje, aby nikt nie ogryzał go.",-
minorunara.ToriiGates.HugeToriiGateFT.DisplayName,Wielka drewniana brama Torii,-
minorunara.ToriiGates.HugeToriiGateFT.Description,"Bramka torii w sanktuarium Itsukushima jest tak ogromna, że wydaje się niemożliwe, aby zatopić ją na dnie tamy.",-
minorunara.ToriiGates.HugeToriiGateFT.Flavor,"Fuzja natury i technologii doprowadziła do stworzenia zaawansowanej bramy torii, która jest odporna na gryzienie przez bobry.",-
minorunara.ToriiGates.HugeToriiGateIT.DisplayName,Wielka metalowa brama torii,-
minorunara.ToriiGates.HugeToriiGateIT.Description,"Bramy torii w Świątyni Kumano Hongu Taisha są tak ogromne, że można je zobaczyć z innej dzielnicy. Nie trzeba dodawać, że są niejadalne.",-
minorunara.ToriiGates.HugeToriiGateIT.Flavor,"„Ale myślałem, że torii pierwotnie były robione, aby wielkie bobry mogły je jeść?” —Pina",-
minorunara.ToriiGates.ToriiCategory.DisplayName,Bramy Torii,-
minorunara.ToriiGates.ToriiCategory.Description,Cześć do Shinto Bóbrów!,-
minorunara.ToriiGates.OrdinaryToriiGateNeed.DisplaynameLocKey,Zwykła brama torii,-
minorunara.ToriiGates.GorgeousToriiGateNeed.DisplaynameLocKey,Wspaniała brama Torii,-
minorunara.ToriiGates.GreatToriiGateNeed.DisplaynameLocKey,Wielka brama Torii,-
minorunara.Lantern.ForwardFacingBench.DisplayName,Ławka skierowana do przodu,-
minorunara.Lantern.ForwardFacingBench.Description,Ławka z ścieżką prowadzącą na tył.,-
minorunara.Lantern.ForwardFacingBench.Flavor,"""jak weszli?""",-
minorunara.Lantern.LanternCategory.DisplayName,lampiony,-
minorunara.Lantern.LanternCategory.Description,Świeci w nocy.,-
minorunara.Lantern.IndoorLantern.DisplayName,Lampa stołowa,-
minorunara.Lantern.IndoorLantern.Description,"Chociaż nazywa się to latarnią wewnętrzną, można ją zainstalować na zewnątrz.",-
minorunara.Lantern.IndoorLantern.Flavor,"Przodkowie bobrów byli zwierzętami nocnymi, aby unikać drapieżników, ale teraz, jako korona całego stworzenia, cieszymy się kąpaniem w świetle dziennym.",-
minorunara.Lantern.StreetLantern.DisplayName,Latarnia uliczna,-
minorunara.Lantern.StreetLantern.Description,Te latarnie są często instalowane przed wartowniami i na ulicach. Będą również używane do oznaczeń sklepów.,-
minorunara.Lantern.StreetLantern.Flavor,"Pomysł, aby znaki sklepowe świeciły, ożywił miasto.",-
minorunara.Lantern.GardenLantern.DisplayName,Latarnia ogrodowa,-
minorunara.Lantern.GardenLantern.Description,Te latarnie są często instalowane w świątyniach i ogrodach.,-
minorunara.Lantern.GardenLantern.Flavor,"Czym jest zen? Czy mogę to zjeść?"""" -Pina",-
minorunara.Lantern.PaperLantern.DisplayName,Papierowa latarnia,-
minorunara.Lantern.PaperLantern.Description,"Te latarnie są używane podczas festiwali i przed barami, aby stworzyć atmosferę różniącą się od codziennego życia.",-
minorunara.Lantern.PaperLantern.Flavor,"Zostawanie na nogach do późna prawdopodobnie cię ekscytuje, ale z umiarem, ponieważ musisz jutro pracować.",-
minorunara.Lantern.ModernLantern1.DisplayName,Nowoczesna latarnia (Trójkąt),-
minorunara.Lantern.ModernLantern1.Description,Latarnia uliczna typu z trójkątnym dachem.,-
minorunara.Lantern.ModernLantern1.Flavor,"Bóbrzy, które pokonały ciemność nocy, nie mają się już czego bać. Poza suszą.",-
minorunara.Lantern.ModernLantern2.DisplayName,Nowoczesna Lampa (Kwadratowa),-
minorunara.Lantern.ModernLantern2.Description,Lampa uliczna w kształcie kwadratu.,-
minorunara.Lantern.ModernLantern2.Flavor,Teraźniejszość ostatecznie stanie się przeszłością. Ale nawet w przyszłości tamy będą nadal ważne.,-
minorunara.ToriiGatesLantern.SettingsHeader,Ustawienia modów bram Torii i latarni,-
minorunara.ToriiGatesLantern.SettingsDiscription,Włącz latarnie i pozwól shide kołysać się na wietrze.,-
minorunara.ToriiGatesLantern.SettingsTooltip,"Możesz to wyłączyć, jeśli uważasz, że jest to irytujące.",-
