ID,Text,Comment
evaporation.settings.enablemod,Ativar Mod,-
evaporation.settings.enablemod.desc,Ativa ou desativa todo o mod.,-
evaporation.settings.coveredevaporationrate,Taxa de Evaporação Coberta,-
evaporation.settings.coveredevaporationrate.desc,"Quão lenta ou rapidamente a água coberta evapora em comparação com a baunilha. 100% = baunilha, 1% é 100x mais lento.",-
evaporation.settings.maxsearchheight,Altura de Busca de Cobertura,-
evaporation.settings.maxsearchheight.desc,"Quão alto acima da água procurar abrigo. Valores mais altos detectam estruturas mais altas, mas podem impactar o desempenho em mapas grandes.",-
evaporation.settings.updateinterval,Verificar Frequência,-
evaporation.settings.updateinterval.desc,"Com que frequência atualizar a detecção de cobertura (1=mais rápido, 10=mais lento). Aproximadamente: 1≈meio dia, 5≈2 dias, 10≈semana.",-
