ID,Text,Comment
LV.CLt.BeaverLifeMul,Multiplicador de Idade do Castor,-
LV.CLt.BeaverLifeMulDesc,"A idade dos castores adultos é multiplicada por este valor, semelhante a um bônus de ""Expectativa de vida"".  
Nota: quanto maior, mais difícil, pois os castores envelhecerão mais rápido.  
Definir para 0 significa que os castores nunca envelhecerão.",-
LV.CLt.ChildhoodDaysMul,Multiplicador de Crescimento da Infância,-
LV.CLt.ChildhoodDaysMulDesc,"O crescimento da infância dos castores é multiplicado por este valor, semelhante a um bônus de ""velocidade de crescimento"".  
Nota: quanto mais alto, mais fácil, pois os jovens castores crescerão mais rapidamente.  
Configurar para 0 significa que as crianças nunca crescerão.",-
LV.CLt.BotLifeMul,Multiplicador de Deterioração do Bot,-
LV.CLt.BotLifeMulDesc,"A deterioração dos bots é multiplicada por este valor, semelhante a um bônus de ""Expectativa de vida"".  
Nota: quanto maior, mais difícil, pois os bots irão se deteriorar mais rápido.  
Configurar para 0 significa que os bots nunca se deteriorarão.",-
