ID,Text,Comment
Building.PhoenixPod.Description,"Inspirados pelos Dentes de Ferro, os Emberpelts usam essas cápsulas para complementar o crescimento populacional.",-
Building.PhoenixPod.DisplayName,Pod Fênix,-
Building.AdvancedPhoenixPod.Description,"Utiliza um processo de reprodução avançado para produzir castores adultos, prontos para começar a trabalhar.",-
Building.AdvancedPhoenixPod.DisplayName,Pod Avançado de Fênix,-
Building.AdvancedPhoenixPod.FlavorDescription,"Como uma Fênix, que eles renasçam do fogo e das cinzas.",-
